{
  "$schema": "./_schema.json",
  "schema_version": "1.0",
  "slug": "dacorum-borough-council",
  "authority": "Dacorum Borough Council",
  "aliases": [
    "Dacorum"
  ],
  "region": "East England",
  "country": "England",
  "ons_code": "E07000096",
  "portal": {
    "url": "https://planning.dacorum.gov.uk/publicaccess/",
    "vendor": "idox-public-access",
    "vendor_verified": true,
    "vendor_source": "portal fingerprint",
    "recipe": "C"
  },
  "reference_format": {
    "example": "26/01673/FHA"
  },
  "retrieval": {
    "status": "tested-ok",
    "scriptable": true,
    "difficulty": "routine",
    "last_tested": "2026-09-16",
    "quirks": [
      {
        "id": "vendor-unverified",
        "kind": "identity",
        "summary": "Portal URL and vendor come from PlanIt's directory; neither the vendor nor any retrieval step has been verified against this portal.",
        "detail": "PlanIt reports scraper_type 'Idox'. That label is a hint, not a finding - it is recorded elsewhere in this skill as stale at one authority and wrong at another. Fingerprint the portal before choosing a recipe, and set portal.vendor_verified when you have.",
        "silent": true,
        "workaround": "Run the vendor detection signatures in vendors.json against the portal before applying any recipe."
      },
      {
        "id": "no-received-date-filter",
        "kind": "search",
        "summary": "The advanced search offers no 'application received' date filter; use date(applicationValidatedStart/End) instead.",
        "detail": "Posting date(applicationReceivedStart) to an install that does not offer it returns HTTP 500, which reads as a portal fault rather than a bad parameter. Fields present: appealDecision, applicationCommittee, applicationDecision, applicationValidated.",
        "silent": false,
        "workaround": "Read the date field names off the advanced search form before posting."
      }
    ],
    "endpoints": {
      "params": {
        "advanced_search_date_field": "date(applicationValidatedStart/End)"
      }
    }
  },
  "source_notes": "",
  "verification": [
    {
      "date": "2026-09-16",
      "result": "untested",
      "note": "Landing-page survey 2026-09-16: HTTP 200; vendor confirmed by fingerprint (idox-public-access)"
    },
    {
      "date": "2026-09-16",
      "result": "tested-ok",
      "verified_download": true,
      "note": "End-to-end: advanced search over 1-31 July 2026 -> first result -> documents tab (8 file links) -> downloaded one file, 65536 bytes, magic bytes 255044462d312e37 = pdf."
    }
  ]
}
