{
  "$schema": "./_schema.json",
  "schema_version": "1.0",
  "slug": "braintree-district-council",
  "authority": "Braintree District Council",
  "aliases": [
    "Braintree"
  ],
  "region": "East England",
  "country": "England",
  "ons_code": "E07000067",
  "portal": {
    "url": "https://publicaccess.braintree.gov.uk/online-applications/search.do?action=advanced",
    "vendor": "idox-public-access",
    "vendor_verified": true,
    "vendor_source": "portal fingerprint",
    "recipe": "C"
  },
  "reference_format": {
    "example": ""
  },
  "retrieval": {
    "status": "untested",
    "scriptable": false,
    "difficulty": "routine",
    "last_tested": null,
    "quirks": [
      {
        "id": "vendor-unverified",
        "kind": "identity",
        "summary": "Portal URL and vendor come from PlanIt's directory; neither the vendor nor any retrieval step has been verified against this portal.",
        "detail": "PlanIt reports scraper_type 'Idox'. That label is a hint, not a finding - it is recorded elsewhere in this skill as stale at one authority and wrong at another. Fingerprint the portal before choosing a recipe, and set portal.vendor_verified when you have.",
        "silent": true,
        "workaround": "Run the vendor detection signatures in vendors.json against the portal before applying any recipe."
      },
      {
        "id": "waf-present",
        "kind": "stability",
        "summary": "WAF signals present (cloudflare) but the landing page served normally.",
        "detail": "Passive at survey time. Not a reason to avoid the automated route; it is a reason to pace properly and to expect a challenge if you do not.",
        "silent": false
      }
    ]
  },
  "source_notes": "",
  "verification": [
    {
      "date": "2026-09-16",
      "result": "untested",
      "note": "Landing-page survey 2026-09-16: HTTP 403; vendor confirmed by fingerprint (idox-public-access); WAF signals: cloudflare"
    }
  ]
}
