{
  "$schema": "./_schema.json",
  "schema_version": "1.0",
  "slug": "edinburgh-city-council",
  "authority": "Edinburgh City Council",
  "aliases": [
    "Edinburgh"
  ],
  "region": "Scotland",
  "country": "Scotland",
  "ons_code": "S12000036",
  "portal": {
    "url": "https://citydev-portal.edinburgh.gov.uk/idoxpa-web/search.do?action=advanced",
    "vendor": "idox-public-access",
    "vendor_verified": false,
    "vendor_source": "planit scraper_type: Idox",
    "recipe": "C"
  },
  "reference_format": {
    "example": ""
  },
  "retrieval": {
    "status": "untested",
    "scriptable": false,
    "difficulty": "routine",
    "last_tested": null,
    "quirks": [
      {
        "id": "vendor-unverified",
        "kind": "identity",
        "summary": "Portal URL and vendor come from PlanIt's directory; neither the vendor nor any retrieval step has been verified against this portal.",
        "detail": "PlanIt reports scraper_type 'Idox'. That label is a hint, not a finding - it is recorded elsewhere in this skill as stale at one authority and wrong at another. Fingerprint the portal before choosing a recipe, and set portal.vendor_verified when you have.",
        "silent": true,
        "workaround": "Run the vendor detection signatures in vendors.json against the portal before applying any recipe."
      }
    ]
  },
  "source_notes": "",
  "verification": []
}
