{
  "$schema": "./_schema.json",
  "schema_version": "1.0",
  "slug": "essex-county-council",
  "authority": "Essex County Council",
  "aliases": [
    "Essex"
  ],
  "region": "East England",
  "country": "England",
  "ons_code": "E10000012",
  "portal": {
    "url": "https://planning.essex.gov.uk/Search/Advanced/",
    "vendor": "def-atrium",
    "vendor_verified": false,
    "vendor_source": "planit scraper_type: Atrium",
    "recipe": "A"
  },
  "reference_format": {
    "example": ""
  },
  "retrieval": {
    "status": "untested",
    "scriptable": false,
    "difficulty": "routine",
    "last_tested": null,
    "quirks": [
      {
        "id": "vendor-unverified",
        "kind": "identity",
        "summary": "Portal URL and vendor come from PlanIt's directory; neither the vendor nor any retrieval step has been verified against this portal.",
        "detail": "PlanIt reports scraper_type 'Atrium'. That label is a hint, not a finding - it is recorded elsewhere in this skill as stale at one authority and wrong at another. Fingerprint the portal before choosing a recipe, and set portal.vendor_verified when you have.",
        "silent": true,
        "workaround": "Run the vendor detection signatures in vendors.json against the portal before applying any recipe."
      }
    ]
  },
  "source_notes": "",
  "verification": []
}
