{
  "$schema": "./_schema.json",
  "schema_version": "1.0",
  "slug": "london-borough-of-barnet",
  "authority": "London Borough of Barnet",
  "aliases": [],
  "region": "London, England",
  "country": "England",
  "ons_code": "E09000003",
  "portal": {
    "url": "https://publicaccess.barnet.gov.uk/online-applications/",
    "vendor": "idox-public-access",
    "vendor_verified": true,
    "vendor_source": "portal fingerprint",
    "recipe": "C"
  },
  "reference_format": {
    "example": ""
  },
  "retrieval": {
    "status": "untested",
    "scriptable": false,
    "difficulty": "routine",
    "last_tested": null,
    "quirks": [
      {
        "id": "search-confirmed-documents-untested",
        "kind": "documents",
        "summary": "The advanced search was exercised successfully in a national survey; document retrieval has NOT been tested at this authority.",
        "detail": "Survey outcome 'ok' on 2026-08-30: the Idox advanced search returned results and the portal behaves as Recipe C expects. That survey was metadata-only and downloaded no documents, so the documents tab, any external DMS, and the file-GET gating are all unverified here. Treat status 'untested' as meaning exactly that.",
        "silent": false,
        "workaround": "Run the documents and download steps of Recipe C and record the result before relying on this authority."
      },
      {
        "id": "waf-present",
        "kind": "stability",
        "summary": "WAF signals present (cloudflare) but the landing page served normally.",
        "detail": "Passive at survey time. Not a reason to avoid the automated route; it is a reason to pace properly and to expect a challenge if you do not.",
        "silent": false
      }
    ],
    "robots": {
      "allowed": false,
      "checked": "2026-08-30",
      "note": "robots.txt disallows the search path for our UA"
    }
  },
  "source_notes": "",
  "verification": [
    {
      "date": "2026-09-16",
      "result": "untested",
      "note": "Landing-page survey 2026-09-16: HTTP 200; vendor confirmed by fingerprint (idox-public-access); WAF signals: cloudflare"
    }
  ]
}
