{
  "$schema": "./_schema.json",
  "schema_version": "1.0",
  "slug": "darlington-borough-council",
  "authority": "Darlington Borough Council",
  "aliases": [],
  "region": "North East, England",
  "country": "England",
  "ons_code": "E06000005",
  "portal": {
    "url": "https://publicaccess.darlington.gov.uk/online-applications/",
    "vendor": "idox-public-access",
    "vendor_verified": true,
    "vendor_source": "portal fingerprint",
    "recipe": "C"
  },
  "reference_format": {
    "example": "26/00743/TFC"
  },
  "retrieval": {
    "status": "tested-ok",
    "scriptable": true,
    "difficulty": "routine",
    "last_tested": "2026-09-16",
    "quirks": [
      {
        "id": "search-confirmed-documents-untested",
        "kind": "documents",
        "summary": "The advanced search was exercised successfully in a national survey; document retrieval has NOT been tested at this authority.",
        "detail": "Survey outcome 'ok' on 2026-08-30: the Idox advanced search returned results and the portal behaves as Recipe C expects. That survey was metadata-only and downloaded no documents, so the documents tab, any external DMS, and the file-GET gating are all unverified here. Treat status 'untested' as meaning exactly that.",
        "silent": false,
        "workaround": "Run the documents and download steps of Recipe C and record the result before relying on this authority."
      },
      {
        "id": "waf-present",
        "kind": "stability",
        "summary": "WAF signals present (cloudflare) but the landing page served normally.",
        "detail": "Passive at survey time. Not a reason to avoid the automated route; it is a reason to pace properly and to expect a challenge if you do not.",
        "silent": false
      }
    ],
    "robots": {
      "allowed": false,
      "checked": "2026-08-30",
      "note": "robots.txt disallows the search path for our UA"
    },
    "endpoints": {
      "params": {
        "advanced_search_date_field": "date(applicationReceivedStart/End)"
      }
    }
  },
  "source_notes": "",
  "verification": [
    {
      "date": "2026-09-16",
      "result": "untested",
      "note": "Landing-page survey 2026-09-16: HTTP 200; vendor confirmed by fingerprint (idox-public-access); WAF signals: cloudflare"
    },
    {
      "date": "2026-09-16",
      "result": "tested-ok",
      "verified_download": true,
      "note": "End-to-end: advanced search over 1-31 July 2026 -> first result -> documents tab (13 file links) -> downloaded one file, 65536 bytes, magic bytes 255044462d312e34 = pdf."
    }
  ]
}
